{
  "$schema": "https://json-schema.org/draft/2020-12/schema",
  "$id": "https://bb2.local/mcp/visualization/query_metric_series_request_v1.schema.json",
  "title": "QueryMetricSeriesRequestV1",
  "type": "object",
  "additionalProperties": false,
  "required": [
    "metric_names",
    "dimension",
    "aggregation",
    "granularity",
    "sort",
    "limit"
  ],
  "properties": {
    "metric_names": {
      "type": "array",
      "minItems": 1,
      "maxItems": 5,
      "items": {
        "type": "string",
        "minLength": 1,
        "maxLength": 64
      }
    },
    "dimension": {
      "type": "string",
      "minLength": 1,
      "maxLength": 64
    },
    "start_date": {
      "type": [
        "string",
        "null"
      ],
      "format": "date"
    },
    "end_date": {
      "type": [
        "string",
        "null"
      ],
      "format": "date"
    },
    "filters": {
      "type": "object",
      "default": {},
      "maxProperties": 10,
      "additionalProperties": {
        "$ref": "#/$defs/scalarValue"
      }
    },
    "aggregation": {
      "enum": [
        "sum",
        "avg",
        "min",
        "max",
        "count"
      ]
    },
    "granularity": {
      "enum": [
        "day",
        "week",
        "month",
        "quarter",
        "year",
        "category"
      ]
    },
    "sort": {
      "enum": [
        "asc",
        "desc"
      ]
    },
    "limit": {
      "type": "integer",
      "minimum": 1,
      "maximum": 100
    }
  },
  "$defs": {
    "scalarValue": {
      "oneOf": [
        {
          "type": "string",
          "maxLength": 256
        },
        {
          "type": "number"
        },
        {
          "type": "boolean"
        },
        {
          "type": "null"
        }
      ]
    }
  }
}
